{"$id":"guard.extension-contribution.v2","$schema":"https://json-schema.org/draft/2020-12/schema","additionalProperties":false,"properties":{"actionClasses":{"items":{"maxLength":4096,"type":"string"},"maxItems":4096,"type":"array"},"activation":{"enum":["default-on","opt-in"]},"description":{"maxLength":4096,"type":"string"},"ecosystemIds":{"items":{"maxLength":4096,"type":"string"},"maxItems":4096,"type":"array"},"executables":{"items":{"maxLength":4096,"type":"string"},"maxItems":4096,"type":"array"},"generated":{"const":true},"homepage":{"anyOf":[{"maxLength":4096,"type":"string"},{"type":"null"}]},"icon":{"anyOf":[{"oneOf":[{"additionalProperties":false,"properties":{"kind":{"const":"none"}},"required":["kind"],"type":"object"},{"additionalProperties":false,"properties":{"background":{"pattern":"^#[0-9a-fA-F]{6}$","type":"string"},"kind":{"const":"react-icon"},"name":{"type":"string"}},"required":["kind","name","background"],"type":"object"}]},{"type":"null"}]},"id":{"maxLength":4096,"type":"string"},"license":{"anyOf":[{"maxLength":4096,"type":"string"},{"type":"null"}]},"name":{"maxLength":4096,"type":"string"},"nativeSource":{"additionalProperties":false,"properties":{"digest":{"pattern":"^[0-9a-f]{64}$","type":"string"},"path":{"pattern":"^contributions/command-sources/command\\.[a-z0-9.-]+\\.json$","type":"string"},"schemaVersion":{"const":"guard.command-extension-source.v1"}},"required":["schemaVersion","path","digest"],"type":"object"},"publisher":{"additionalProperties":false,"properties":{"displayName":{"maxLength":4096,"type":"string"},"id":{"maxLength":4096,"type":"string"},"url":{"anyOf":[{"maxLength":4096,"type":"string"},{"type":"null"}]}},"required":["id","displayName"],"type":"object"},"referenceUrls":{"items":{"maxLength":4096,"type":"string"},"maxItems":4096,"type":"array"},"riskClasses":{"items":{"maxLength":4096,"type":"string"},"maxItems":4096,"type":"array"},"saferAlternatives":{"items":{"maxLength":4096,"type":"string"},"maxItems":4096,"type":"array"},"schemaVersion":{"const":"guard.extension-contribution.v2"},"trustClass":{"enum":["first-party","trusted-library","external"]},"version":{"maxLength":4096,"type":"string"}},"required":["actionClasses","activation","description","ecosystemIds","executables","generated","homepage","icon","id","license","name","nativeSource","publisher","referenceUrls","riskClasses","saferAlternatives","schemaVersion","trustClass","version"],"type":"object"}
