{"actionClasses":["DigitalOcean access change","DigitalOcean credential exposure","DigitalOcean destructive command","DigitalOcean disruptive command","DigitalOcean remote execution"],"activation":"default-on","description":"Reviews destructive, disruptive, access-changing, credential-exposing and remote-execution doctl operations, while Guard's read proof keeps ordinary doctl list and get reads quiet.","ecosystemIds":[],"executables":[],"generated":true,"homepage":null,"icon":{"kind":"none"},"id":"command.cloud.digitalocean","license":null,"name":"DigitalOcean command protection","nativeSource":{"digest":"d7bbc1b2c8757bbbff711464a8339ec2c97111ec7ef04a2cc6e8a6514fb3ae75","path":"contributions/command-sources/command.cloud.digitalocean.json","schemaVersion":"guard.command-extension-source.v1"},"publisher":{"displayName":"HOL curated library","id":"hol-curated"},"referenceUrls":["https://docs.digitalocean.com/reference/doctl/","https://docs.digitalocean.com/reference/doctl/reference/compute/droplet/delete/","https://docs.digitalocean.com/reference/doctl/reference/compute/droplet-action/power-off/","https://docs.digitalocean.com/reference/doctl/reference/kubernetes/cluster/delete/","https://docs.digitalocean.com/reference/doctl/reference/kubernetes/cluster/kubeconfig/show/","https://docs.digitalocean.com/reference/doctl/reference/registry/garbage-collection/start/","https://docs.digitalocean.com/reference/doctl/reference/registry/docker-config/","https://docs.digitalocean.com/reference/doctl/reference/databases/pool/delete/","https://docs.digitalocean.com/reference/doctl/reference/projects/resources/assign/","https://docs.digitalocean.com/reference/doctl/reference/auth/token/","https://github.com/digitalocean/doctl"],"riskClasses":["credential_access","destructive_shell","network_egress","permission_change","remote_execution"],"saferAlternatives":["Get or list the exact resource and confirm the active doctl auth context before changing it."],"schemaVersion":"guard.extension-contribution.v2","trustClass":"trusted-library","version":"1.0.0"}
