{"actionClasses":["drip setup command","drip ledger import command","drip agent launch command"],"activation":"opt-in","description":"Reviews drip runs that change local setup (install), write the token ledger (sync) or launch another command (run), and keeps the read-only views (statusline, session, history, explain, open, splash, watch) unreviewed.","ecosystemIds":["drip"],"executables":["drip"],"generated":true,"homepage":"https://github.com/beausterling/drip-ai-water-usage","icon":{"kind":"none"},"id":"command.drip","license":"MIT","name":"drip command protection","nativeSource":{"digest":"148506e2974beece51c49edbfe7b9b72b9f662d68c0a3bf885a92431ace45bbd","path":"contributions/command-sources/command.drip.json","schemaVersion":"guard.command-extension-source.v1"},"publisher":{"displayName":"Beau Sterling","id":"community.drip","url":"https://github.com/beausterling/drip-ai-water-usage"},"referenceUrls":["https://github.com/beausterling/drip-ai-water-usage/blob/cd215045f2bf1bba448cd1a294936536867abeba/README.md","https://github.com/beausterling/drip-ai-water-usage/blob/cd215045f2bf1bba448cd1a294936536867abeba/drip/cli.py","https://github.com/beausterling/drip-ai-water-usage/blob/cd215045f2bf1bba448cd1a294936536867abeba/drip/run.py"],"riskClasses":["destructive_shell","execution"],"saferAlternatives":["Read with `drip`, `drip session`, `drip history` or `drip explain`; start agents directly and run `drip watch` in your own split pane."],"schemaVersion":"guard.extension-contribution.v2","trustClass":"external","version":"1.0.0"}
