{"actionClasses":["CodeSage hook installation command","CodeSage MCP registration command","CodeSage MCP unregistration command"],"activation":"opt-in","description":"Reviews CodeSage commands that install Git hooks or change MCP server registration. doctor, status, and search are outside these rules.","ecosystemIds":["codesage"],"executables":["codesage","codesage.cmd","codesage.exe"],"generated":true,"homepage":"https://github.com/iliaal/codesage","icon":{"kind":"none"},"id":"command.codesage","license":"Apache-2.0","name":"CodeSage command protection","nativeSource":{"digest":"24306f28ca55a84c3ae4ede44c68f7433c19bdadb7502e20fe3332480d179896","path":"contributions/command-sources/command.codesage.json","schemaVersion":"guard.command-extension-source.v1"},"publisher":{"displayName":"Ilia Alshanetsky","id":"community.iliaal","url":"https://github.com/iliaal"},"referenceUrls":["https://github.com/iliaal/codesage"],"riskClasses":["destructive_shell"],"saferAlternatives":["Inspect existing Git hooks and review codesage install-hooks --help before installing hooks.","Review the target agent configuration and the scope of --global before registering CodeSage.","Review the target agent configuration and the scope of --global before unregistering CodeSage."],"schemaVersion":"guard.extension-contribution.v2","trustClass":"external","version":"1.0.0"}
