{"actionClasses":["x402shield live payment execution command","x402shield external signer service command","x402shield authorization issuer service command","x402shield gateway database migration command"],"activation":"opt-in","description":"Reviews x402Shield commands that can directly affect authorization, signing, migration, or live payment execution. Payment-intent binding stays enforced by x402Shield itself; this descriptor only classifies each invocation.","ecosystemIds":[],"executables":["x402shield-e2e-buyer-runner","x402shield-external-signer","x402shield-authorization-issuer","x402shield-gateway"],"generated":true,"homepage":null,"icon":{"kind":"none"},"id":"command.x402shield","license":null,"name":"x402Shield command protection","nativeSource":{"digest":"86c67a0cc60ca4190de3006fcf943236e83bb2e2f36042a5c5987aff19a64417","path":"contributions/command-sources/command.x402shield.json","schemaVersion":"guard.command-extension-source.v1"},"publisher":{"displayName":"Community","id":"community"},"referenceUrls":["https://x402shield.dev"],"riskClasses":["financial_transaction","destructive_shell"],"saferAlternatives":["Use the read-only diagnostic subcommands before any live payment run."],"schemaVersion":"guard.extension-contribution.v2","trustClass":"external","version":"1.0.0"}
