{"actionClasses":["Iterlay provider-quota use","Iterlay managed and exported file writes","Iterlay agent configuration changes","Iterlay workspace mutations and unknown invocations"],"activation":"opt-in","description":"Reviews Iterlay CLI invocations that can spend provider quota, write managed or exported files, change workspace state, or install agent configuration. Explicit read-only paths narrow this rule; Guard independent floors remain in effect.","ecosystemIds":["iterlay"],"executables":["iterlay"],"generated":true,"homepage":"https://github.com/Davied-H/iterlay","icon":{"background":"#0F172A","kind":"react-icon","name":"HiMiniCommandLine"},"id":"command.iterlay","license":"MIT","name":"Iterlay command protection","nativeSource":{"digest":"fca37e272e1cb122d2550cfe435c3f629aa134db3dbf20a257f9a6b69c9c9d9a","path":"contributions/command-sources/command.iterlay.json","schemaVersion":"guard.command-extension-source.v1"},"publisher":{"displayName":"Community","id":"community.iterlay","url":"https://github.com/Davied-H/iterlay"},"referenceUrls":["https://github.com/Davied-H/iterlay/blob/main/cli/src/main.ts","https://github.com/Davied-H/iterlay/blob/main/electron/workspace-tools.ts"],"riskClasses":["execution","filesystem_write","network_egress"],"saferAlternatives":["Inspect iterlay tools list and the requested operation before running it.","Confirm provider cost and reference-image disclosure before generation or editing.","Export to a new destination; --overwrite can replace existing files.","Review add/remove agent configuration changes. Ctrl+C stops waiting, not remote billing."],"schemaVersion":"guard.extension-contribution.v2","trustClass":"external","version":"1.0.0"}
