{"actionClasses":["Azure DNS destructive command"],"activation":"default-on","description":"Reviews Azure public DNS, private DNS, virtual-network link, and DNS resolver deletion through Azure CLI.","ecosystemIds":[],"executables":["az"],"generated":true,"homepage":null,"icon":{"kind":"none"},"id":"command.dns.azure","license":null,"name":"Azure DNS command protection","nativeSource":{"digest":"014cac22bfde7dfa78c8b2811fc330f5cef0abc497fbd3915906cf59e26617e6","path":"contributions/command-sources/command.dns.azure.json","schemaVersion":"guard.command-extension-source.v1"},"publisher":{"displayName":"HOL curated library","id":"hol-curated"},"referenceUrls":["https://learn.microsoft.com/cli/azure/network/dns/zone","https://learn.microsoft.com/cli/azure/network/dns/record-set","https://learn.microsoft.com/cli/azure/network/private-dns/zone","https://learn.microsoft.com/cli/azure/dns-resolver"],"riskClasses":["destructive_shell","network_egress"],"saferAlternatives":["Export zone records and inspect private DNS links before deletion."],"schemaVersion":"guard.extension-contribution.v2","trustClass":"trusted-library","version":"1.0.0"}
