{"actionClasses":["uivoid live project creation command","uivoid outbound credential rotation command","uivoid oauth passthrough configuration command","uivoid session credential write command","uivoid agent skill install command"],"activation":"opt-in","description":"Reviews uivoid commands that create or reconfigure a live MCP server mapped from an existing API, rotate the credential it calls that API with, or write local session and skill files a later command or agent session will trust.","ecosystemIds":[],"executables":["uivoid"],"generated":true,"homepage":"https://github.com/corrideluca/uivoid-cli","icon":{"kind":"none"},"id":"command.uivoid","license":"MIT","name":"uivoid command protection","nativeSource":{"digest":"deb41c16e7edaeff928026a145477f2ea3390304473c1989d52277f7fc2bd5d5","path":"contributions/command-sources/command.uivoid.json","schemaVersion":"guard.command-extension-source.v1"},"publisher":{"displayName":"Community","id":"community.corrideluca","url":"https://github.com/corrideluca"},"referenceUrls":["https://github.com/corrideluca/uivoid-cli","https://portal.uivoid.app/docs"],"riskClasses":["destructive_shell","network_egress"],"saferAlternatives":["Review the project name and target API before running uivoid create.","Confirm a credential rotation or oauth-config change against the intended project before approving."],"schemaVersion":"guard.extension-contribution.v2","trustClass":"external","version":"1.0.0"}
