{"actionClasses":["Salesforce data command"],"activation":"opt-in","description":"Opt-in review of pinned Salesforce CLI sf data create, update, delete, export and bulk job resume routes; blocks hard delete. It does not resolve the target org or mediate provider execution.","ecosystemIds":[],"executables":["sf","sf.cmd","sfdx","sfdx.cmd"],"generated":true,"homepage":null,"icon":{"kind":"none"},"id":"command.salesforce.sf","license":null,"name":"Salesforce sf data command risk rules","nativeSource":{"digest":"b5abd565cf0c747210aec02adc0652d38b0ee5c0ab904250945c2b4866c29f4c","path":"contributions/command-sources/command.salesforce.sf.json","schemaVersion":"guard.command-extension-source.v1"},"publisher":{"displayName":"Community","id":"community"},"referenceUrls":["https://www.npmjs.com/package/@salesforce/plugin-data/v/5.1.10","https://developer.salesforce.com/docs/atlas.en-us.sfdx_cli_reference.meta/sfdx_cli_reference/cli_reference_data_commands_unified.htm"],"riskClasses":["destructive","network_egress"],"saferAlternatives":["Review the target org, object, record set or query, and job ID before confirming."],"schemaVersion":"guard.extension-contribution.v2","trustClass":"external","version":"1.0.0"}
