{"actionClasses":["Email destructive command"],"activation":"default-on","description":"Reviews email identity, template, configuration-set, and contact-list deletion through AWS CLI.","ecosystemIds":[],"executables":[],"generated":true,"homepage":null,"icon":{"kind":"none"},"id":"command.email","license":null,"name":"Email service command protection","nativeSource":{"digest":"1bd9d6b0d9c56560291af345a6b7a26f075c2c42a323852e91b1fb1c432bcdf4","path":"contributions/command-sources/command.email.json","schemaVersion":"guard.command-extension-source.v1"},"publisher":{"displayName":"HOL curated library","id":"hol-curated"},"referenceUrls":["https://docs.aws.amazon.com/cli/latest/reference/ses/delete-identity.html","https://docs.aws.amazon.com/cli/latest/reference/sesv2/delete-email-identity.html","https://docs.aws.amazon.com/cli/latest/reference/sesv2/delete-contact-list.html"],"riskClasses":["destructive_shell","network_egress"],"saferAlternatives":["Verify sending dependencies and export configuration before deletion."],"schemaVersion":"guard.extension-contribution.v2","trustClass":"trusted-library","version":"1.0.0"}
