{"actionClasses":["faf-cli agent tool configuration command","faf-cli git and CI persistence command","faf-cli data egress command","faf-cli agent instruction write command","faf-cli project context write command"],"activation":"opt-in","description":"Reviews faf-cli commands that write agent instruction files (AGENTS.md, CLAUDE.md, .cursorrules, GEMINI.md, Copilot instructions), add an MCP server to an agent's config, install git hooks, git drivers or CI workflows, send project context off the machine, or rewrite faf's own project files (project.faf, .fafb, soul.fafm, cards). Read-only commands (score, check, dna, context, drift, log, diff, convert, search, share, wjttc, info, formats, demo) are not matched by this extension; Guard's default handling for commands no rule matches still applies to them. Covers the `faf` and `faf-cli` executables; npx, bunx, pnpx, pnpm, yarn, npm exec, yarn exec, npm x, bun x, pnpm dlx and yarn dlx launches of either bin name; and versioned launches (`pkg@tag`) of the `faf-cli` npm package.","ecosystemIds":[],"executables":["faf","faf-cli"],"generated":true,"homepage":"https://faf.one","icon":{"background":"#00B8B8","kind":"react-icon","name":"HiMiniCommandLine"},"id":"command.faf-cli","license":"MIT","name":"faf-cli command protection","nativeSource":{"digest":"4c16e9bda9fd60b59c535dee9166e146b5122a0a6f0fdaffed40d9e1f90221d0","path":"contributions/command-sources/command.faf-cli.json","schemaVersion":"guard.command-extension-source.v1"},"publisher":{"displayName":"Community","id":"community.wolfe-jam","url":"https://github.com/Wolfe-Jam"},"referenceUrls":["https://github.com/Wolfe-Jam/faf-cli","https://www.npmjs.com/package/faf-cli"],"riskClasses":["destructive_shell","execution","network_egress","data_flow_exfiltration"],"saferAlternatives":["Run `faf score` or `faf check` to inspect project context without writing anything.","Commit before running a faf write so every change is a reviewable diff."],"schemaVersion":"guard.extension-contribution.v2","trustClass":"external","version":"1.1.0"}
