{"actionClasses":["showtime dependency install","showtime agent configuration change","showtime file removal","showtime network download","showtime browser automation"],"activation":"opt-in","description":"Reviews the showtime video-studio CLI's commands that reach beyond the video project: installing tools and models (setup), writing other coding agents' configuration (install), deleting files (setup --prune, clean, voice cache --clear), explicit network downloads (audio music|lib|packs fetch, assets media fetch, reference <URL>) and driving a headless browser against a site or a walkthrough script (site capture|component|record, demo record). Project-local commands (new, check, render, qa, export, look, snap, receipt, doctor, guide, status) and --help are not matched and remain automatic. Components that ordinary commands fetch on first use (for example a speech model on the first transcription) are outside this extension; `showtime setup --plan` lists them.","ecosystemIds":[],"executables":["showtime","showtime.cmd","showtime.ps1"],"generated":true,"homepage":"https://github.com/FavioVazquez/showtime","icon":{"kind":"none"},"id":"command.showtime","license":"MIT","name":"showtime command protection","nativeSource":{"digest":"34d6209d9c2397dc8a69b059f54925c735a9a364e45ad1452793acb4631eb715","path":"contributions/command-sources/command.showtime.json","schemaVersion":"guard.command-extension-source.v1"},"publisher":{"displayName":"Favio Vázquez","id":"community.showtime","url":"https://github.com/FavioVazquez/showtime"},"referenceUrls":["https://github.com/FavioVazquez/showtime","https://faviovazquez.github.io/showtime/","https://github.com/FavioVazquez/showtime/releases/tag/v0.3.2","https://github.com/FavioVazquez/showtime/blob/v0.3.2/skills/showtime/setup/setup.py","https://github.com/FavioVazquez/showtime/blob/v0.3.2/skills/showtime/lib/st/cli_install.py","https://github.com/FavioVazquez/showtime/blob/v0.3.2/skills/showtime/lib/st/cli_job.py","https://github.com/FavioVazquez/showtime/blob/v0.3.2/skills/showtime/lib/st/cli_audio.py","https://github.com/FavioVazquez/showtime/blob/v0.3.2/skills/showtime/lib/st/cli_capture.py","https://github.com/FavioVazquez/showtime/blob/v0.3.2/skills/showtime/scripts/site.mjs","https://github.com/FavioVazquez/showtime/blob/v0.3.2/skills/showtime/scripts/demo.mjs"],"riskClasses":["destructive_shell","execution","network_egress"],"saferAlternatives":["Use the print-only forms first: `showtime setup --estimate|--plan|--list`, `showtime install --print`, `showtime clean --dry-run`."],"schemaVersion":"guard.extension-contribution.v2","trustClass":"external","version":"1.0.0"}
