{"actionClasses":["Skill Sunset configuration audit command"],"activation":"opt-in","description":"Reviews the canonical Skill Sunset audit surface and its local report and viewer side effects. Experiment execution and npm launcher policy remain outside this extension.","ecosystemIds":[],"executables":[],"generated":true,"homepage":"https://github.com/ooocooc/open-skill-sunset","icon":{"background":"#6B21A8","kind":"react-icon","name":"HiMiniCube"},"id":"command.skill-sunset","license":"MIT","name":"Skill Sunset command protection","nativeSource":{"digest":"3f3128c5b72d07c095283d189369780d47568f4a25bb9357e6a767fb50d057b5","path":"contributions/command-sources/command.skill-sunset.json","schemaVersion":"guard.command-extension-source.v1"},"publisher":{"displayName":"Community","id":"community.ooocooc","url":"https://github.com/ooocooc/open-skill-sunset"},"referenceUrls":["https://github.com/ooocooc/open-skill-sunset/blob/main/src/cli.js"],"riskClasses":["local_secret_read"],"saferAlternatives":["Confirm the audit target and output directory before running Skill Sunset.","Treat generated findings as advisory evidence and review them before changing agent configuration."],"schemaVersion":"guard.extension-contribution.v2","trustClass":"external","version":"1.0.0"}
