{"actionClasses":["answerLoops self-hosted instance setup command","answerLoops agent skill install command"],"activation":"opt-in","description":"Reviews answerLoops CLI commands that start a self-hosted instance with Docker Compose or download agent skill files into ./.claude/skills/. Help and usage output are not reviewed.","ecosystemIds":[],"executables":["answerloops"],"generated":true,"homepage":"https://github.com/answerLoops/answerLoops","icon":{"kind":"none"},"id":"command.answerloops","license":null,"name":"answerLoops CLI command protection","nativeSource":{"digest":"51ae09dcba7751cd88587671c375542121f793d06059a8d1b8de2011844af9ff","path":"contributions/command-sources/command.answerloops.json","schemaVersion":"guard.command-extension-source.v1"},"publisher":{"displayName":"Community","id":"community.answerloops","url":"https://github.com/answerLoops"},"referenceUrls":["https://github.com/answerLoops/answerLoops/blob/main/packages/agent-sdk/src/cli/index.ts","https://github.com/answerLoops/answerLoops/blob/main/packages/agent-sdk/src/cli/setup.ts","https://github.com/answerLoops/answerLoops/blob/main/packages/agent-sdk/src/cli/skills.ts"],"riskClasses":["destructive_shell","execution","network_egress"],"saferAlternatives":["Confirm the target directory and that starting Docker containers on this machine is intended before running setup.","Read the skill files under skills/ in the answerLoops repository before installing them into ./.claude/skills/."],"schemaVersion":"guard.extension-contribution.v2","trustClass":"external","version":"1.0.0"}
