{"actionClasses":["Xencode worktree mutation","Xencode plugin mutation"],"activation":"opt-in","description":"Reviews Xencode state-changing CLI operations that can mutate Git worktrees or the local Xencode plugin environment. This community coverage does not certify Xencode or every future CLI feature.","ecosystemIds":["xencode"],"executables":["xencode","xencode.exe"],"generated":true,"homepage":null,"icon":{"kind":"none"},"id":"command.xencode","license":null,"name":"Xencode command protection","nativeSource":{"digest":"366bbdf71e7e1f62a0c715b85d3924f447ab1d7c84f9c6bbf3e01f7d309dd311","path":"contributions/command-sources/command.xencode.json","schemaVersion":"guard.command-extension-source.v1"},"publisher":{"displayName":"Community","id":"community"},"referenceUrls":["https://github.com/sreevarshan-xenoz/xencode","https://github.com/sreevarshan-xenoz/xencode/blob/main/CLI_GUIDE.md"],"riskClasses":["destructive_shell"],"saferAlternatives":["Inspect the target worktree and current repository state before changing or removing it.","Review the plugin path or name before installing or removing an Xencode plugin."],"schemaVersion":"guard.extension-contribution.v2","trustClass":"external","version":"1.0.0"}
