{"actionClasses":["Laravel database wipe command","Laravel destructive rebuild command","Laravel migration reset command","Laravel migration rollback command","Laravel queue purge command"],"activation":"default-on","description":"Reviews destructive Artisan database wipes, migration resets, and queue purges.","ecosystemIds":[],"executables":[],"generated":true,"homepage":null,"icon":{"kind":"none"},"id":"command.framework.laravel","license":null,"name":"Laravel command protection","nativeSource":{"digest":"11e5eb9103ed664eafd1c5e3c329a8c8aabb3aebfa34ff848e826ae271d994f2","path":"contributions/command-sources/command.framework.laravel.json","schemaVersion":"guard.command-extension-source.v1"},"publisher":{"displayName":"HOL curated library","id":"hol-curated"},"referenceUrls":["https://laravel.com/docs/13.x/migrations","https://laravel.com/docs/13.x/queues","https://laravel.com/docs/13.x/artisan"],"riskClasses":["destructive_shell","network_egress"],"saferAlternatives":["Inspect migration status and queue depth before destructive Artisan operations."],"schemaVersion":"guard.extension-contribution.v2","trustClass":"trusted-library","version":"1.0.0"}
