{"actionClasses":["LLMRig setup and verification execution","LLMRig report file creation","LLMRig optional agent and inference experiment","LLMRig Rescue report file creation"],"activation":"opt-in","description":"External, locally opt-in command safety rules for LLMRig execution, Rescue experiments and report file creation, while excluding read-only inspection commands.","ecosystemIds":[],"executables":["llmrig","llmrig.cmd","llmrig.exe"],"generated":true,"homepage":"https://github.com/sunilteja93/llmrig","icon":{"kind":"none"},"id":"command.llmrig","license":"MIT","name":"LLMRig command protection","nativeSource":{"digest":"7550973c43ac9252209e9060201e615a9b150ca43b0c311d32afde7deec8e8f5","path":"contributions/command-sources/command.llmrig.json","schemaVersion":"guard.command-extension-source.v1"},"publisher":{"displayName":"LLMRig","id":"community.llmrig","url":"https://github.com/sunilteja93/llmrig"},"referenceUrls":["https://github.com/sunilteja93/llmrig","https://github.com/sunilteja93/llmrig/blob/1e79048278e13bd3341acd70f8080bd741796a0d/README.md"],"riskClasses":["execution","network_egress"],"saferAlternatives":["Use LLMRig plan and doctor to inspect readiness before execution.","Review Rescue experiments before opt-in.","Inspect privacy-filtered report output before saving."],"schemaVersion":"guard.extension-contribution.v2","trustClass":"external","version":"1.0.0"}
