{"actionClasses":["Skill Base publication"],"activation":"opt-in","description":"Reviews authenticated Skill Base CLI publications before local Skill files are uploaded as a new version.","ecosystemIds":[],"executables":["skb","skb.cmd","skb.exe"],"generated":true,"homepage":"https://github.com/ginuim/skill-base","icon":{"kind":"none"},"id":"command.skill-base","license":"MIT","name":"Skill Base CLI","nativeSource":{"digest":"025ce92d4e824cbc12e0e94530946777944e84e6feb3d2c7cd3a6611b3894a06","path":"contributions/command-sources/command.skill-base.json","schemaVersion":"guard.command-extension-source.v1"},"publisher":{"displayName":"Skill Base","id":"ginuim","url":"https://github.com/ginuim/skill-base"},"referenceUrls":["https://github.com/ginuim/skill-base/blob/main/cli/lib/commands/publish.js","https://github.com/ginuim/skill-base/blob/main/docs/zh/cli.md"],"riskClasses":["data_flow_exfiltration","execution","network_egress"],"saferAlternatives":["Run `skb publish --dry-run` for the same directory and ignore rules, then review the included files before publishing."],"schemaVersion":"guard.extension-contribution.v2","trustClass":"external","version":"1.0.0"}
