{"actionClasses":["MongoDB destructive command"],"activation":"default-on","description":"Reviews restore operations that drop and replace collections.","ecosystemIds":[],"executables":[],"generated":true,"homepage":null,"icon":{"kind":"none"},"id":"command.database.mongodb","license":null,"name":"MongoDB command protection","nativeSource":{"digest":"c55ba1032c2523cdbd6eb30539a88ec1ac4d1548184b7841b8edf1e55ac5c1ff","path":"contributions/command-sources/command.database.mongodb.json","schemaVersion":"guard.command-extension-source.v1"},"publisher":{"displayName":"HOL curated library","id":"hol-curated"},"referenceUrls":["https://www.mongodb.com/docs/database-tools/mongorestore/"],"riskClasses":["destructive_shell","network_egress"],"saferAlternatives":["Use mongorestore --dryRun and inspect selected database collections first."],"schemaVersion":"guard.extension-contribution.v2","trustClass":"trusted-library","version":"1.0.0"}
