{"actionClasses":["Velero destructive command"],"activation":"default-on","description":"Reviews Velero operations that delete backup data or recovery records.","ecosystemIds":[],"executables":[],"generated":true,"homepage":null,"icon":{"kind":"none"},"id":"command.backup.velero","license":null,"name":"Velero command protection","nativeSource":{"digest":"1b6079a6519f68b0323b473c77773cdbb55a14835e85a687afd5f64b9341a537","path":"contributions/command-sources/command.backup.velero.json","schemaVersion":"guard.command-extension-source.v1"},"publisher":{"displayName":"HOL curated library","id":"hol-curated"},"referenceUrls":["https://velero.io/docs/main/backup-reference/"],"riskClasses":["destructive_shell","network_egress"],"saferAlternatives":["Describe the backup and confirm object-storage and snapshot retention first."],"schemaVersion":"guard.extension-contribution.v2","trustClass":"trusted-library","version":"1.0.0"}
