{"actionClasses":[],"activation":"default-on","description":"Routes Node package installs and one-shot execution through Guard's package firewall.","ecosystemIds":["npm"],"executables":["npm","npx","pnpm","yarn","bun","bunx"],"generated":true,"homepage":null,"icon":{"kind":"none"},"id":"command.package.node","license":null,"name":"Node package protection","nativeSource":{"digest":"4e1e5d7e3cd09665ceecd2d28d74ea7817467e3cbd30eb905763dcfc960121fa","path":"contributions/command-sources/command.package.node.json","schemaVersion":"guard.command-extension-source.v1"},"publisher":{"displayName":"HOL","id":"hol"},"referenceUrls":["https://docs.npmjs.com/cli/install/","https://pnpm.io/cli/add","https://yarnpkg.com/cli/add","https://bun.sh/docs/pm/cli/add"],"riskClasses":["supply_chain"],"saferAlternatives":["Use the existing project manifest and lockfile instead of an unpinned package source.","Review package provenance and advisory evidence before installation or one-shot execution."],"schemaVersion":"guard.extension-contribution.v2","trustClass":"first-party","version":"1.0.0"}
