{"actionClasses":["hcs-trace inspect command","hcs-trace follow command","hcs-trace scan command","hcs-trace write command"],"activation":"opt-in","description":"Reviews HCS Trace 0.2.0 topic inspection, live polling, full-topic scans, and exports. Covers direct executables and positional npx/npm exec package invocations, including version suffixes. Direct help narrows only the matching rule; package-launcher help retains review. The CLI reads Hedera data and can write export files locally.","ecosystemIds":[],"executables":["hcs-trace","hcs-trace.cmd","hcs-trace.exe"],"generated":true,"homepage":"https://github.com/signalnodes/hcs-trace","icon":{"kind":"none"},"id":"command.hcs-trace","license":"MIT","name":"HCS Trace","nativeSource":{"digest":"abed552f024f2fa338f745ffdc0f0a38767ed88c58cb749e177fcbd13c3c64d5","path":"contributions/command-sources/command.hcs-trace.json","schemaVersion":"guard.command-extension-source.v1"},"publisher":{"displayName":"Community","id":"community"},"referenceUrls":["https://github.com/signalnodes/hcs-trace/tree/8178a866b989e8413376afc16ae140b848dd8764","https://www.npmjs.com/package/hcs-trace/v/0.2.0"],"riskClasses":["network","filesystem"],"saferAlternatives":["Use bounded inspection where possible and choose a new path for file exports."],"schemaVersion":"guard.extension-contribution.v2","trustClass":"external","version":"1.0.0"}
