{
  "actionClasses": [
    "claude tmux session teardown command",
    "claude tmux process prune command"
  ],
  "activation": "opt-in",
  "description": "Reviews claude-tmux-cleanup runs that kill agent-team sessions or Claude Code processes.",
  "ecosystemIds": [],
  "executables": [
    "claude-tmux-cleanup",
    "ctc"
  ],
  "generated": true,
  "homepage": "https://github.com/s403o/claude-code-tmux",
  "icon": {
    "kind": "none"
  },
  "id": "command.claude-tmux",
  "license": null,
  "name": "Claude tmux cleanup protection",
  "nativeSource": {
    "digest": "630f93f0dd0735917e528298140838d624fda82f900d38d51f8678d273fb0165",
    "path": "contributions/command-sources/command.claude-tmux.json",
    "schemaVersion": "guard.command-extension-source.v1"
  },
  "publisher": {
    "displayName": "Community",
    "id": "community"
  },
  "referenceUrls": [
    "https://github.com/s403o/claude-code-tmux"
  ],
  "riskClasses": [
    "destructive_shell"
  ],
  "saferAlternatives": [
    "Use --dry-run to list the sessions and pids before killing anything."
  ],
  "schemaVersion": "guard.extension-contribution.v2",
  "trustClass": "external",
  "version": "1.0.0"
}
