{"actionClasses":["infrastructure destructive command"],"activation":"default-on","description":"Reviews infrastructure teardown through Terraform, OpenTofu, and Pulumi.","ecosystemIds":[],"executables":[],"generated":true,"homepage":null,"icon":{"kind":"none"},"id":"command.infrastructure-as-code","license":null,"name":"Infrastructure-as-code protection","nativeSource":{"digest":"f6e5110e701620939287766e3f13bc50b2d90ab11b49d9a8c36c2bfe585d8026","path":"contributions/command-sources/command.infrastructure-as-code.json","schemaVersion":"guard.command-extension-source.v1"},"publisher":{"displayName":"HOL curated library","id":"hol-curated"},"referenceUrls":["https://developer.hashicorp.com/terraform/cli/commands/destroy","https://opentofu.org/docs/cli/commands/destroy/","https://www.pulumi.com/docs/iac/cli/commands/pulumi_destroy/"],"riskClasses":["destructive_shell","network_egress"],"saferAlternatives":["Create and inspect a saved plan or preview before applying destructive changes.","Confirm the selected workspace, stack, account, and region before teardown."],"schemaVersion":"guard.extension-contribution.v2","trustClass":"trusted-library","version":"1.0.0"}
