{"actionClasses":["cs pin state command","cs session archive command","cs session resume command","cs session summary command"],"activation":"opt-in","description":"Reviews cs (Claude Sessions) commands that launch Claude Code in another folder, write pin or archive files, or send session text to a model for a recap. Read-only commands (ls, show) are not matched.","ecosystemIds":[],"executables":[],"generated":true,"homepage":"https://github.com/AryaKesharwani/claude-sessions","icon":{"kind":"none"},"id":"command.cs","license":"MIT","name":"cs (Claude Sessions) command protection","nativeSource":{"digest":"5d43c59ff47caae52580126e07c044959d1f5faaf892808fa29b0f1c28a0b2dc","path":"contributions/command-sources/command.cs.json","schemaVersion":"guard.command-extension-source.v1"},"publisher":{"displayName":"Community","id":"community.claude-sessions","url":"https://github.com/AryaKesharwani/claude-sessions"},"referenceUrls":["https://github.com/AryaKesharwani/claude-sessions#the-cs-cli","https://github.com/AryaKesharwani/claude-sessions/blob/main/cs.py"],"riskClasses":["execution","destructive_shell","network_egress","data_flow_exfiltration"],"saferAlternatives":["Use `cs ls` and `cs show <id>` (read-only) to inspect sessions before resuming, summarizing or archiving them."],"schemaVersion":"guard.extension-contribution.v2","trustClass":"external","version":"1.0.0"}
